{
  "$schema": "https://raw.githubusercontent.com/roonga/a2-react-aria/main/registry/schema.json",
  "name": "radio",
  "type": "registry:component",
  "title": "RadioGroup",
  "description": "Radio and RadioGroup single-select controls.",
  "dependencies": [
    "react-aria-components",
    "zod"
  ],
  "registryDependencies": [],
  "files": [
    {
      "path": "radio/Radio.tsx",
      "content": "import { RadioButton, RadioField } from \"react-aria-components\"\nimport { getRadioStyles } from \"./radio.styles\"\n\ninterface RadioProps {\n\treadonly label?: string\n\treadonly value: string\n\treadonly isDisabled?: boolean\n}\n\nexport function Radio({ label, value, isDisabled = false }: RadioProps) {\n\tconst styles = getRadioStyles()\n\n\treturn (\n\t\t<RadioField value={value} isDisabled={isDisabled} className={styles.field}>\n\t\t\t<RadioButton className={styles.button}>\n\t\t\t\t{({ isSelected, isDisabled: dis, isInvalid }) => (\n\t\t\t\t\t<>\n\t\t\t\t\t\t<div className={styles.indicator({ isSelected, isDisabled: dis, isInvalid })}>\n\t\t\t\t\t\t\t{isSelected && <div className={styles.dot} />}\n\t\t\t\t\t\t</div>\n\t\t\t\t\t\t{label}\n\t\t\t\t\t</>\n\t\t\t\t)}\n\t\t\t</RadioButton>\n\t\t</RadioField>\n\t)\n}\n",
      "type": "registry:component"
    },
    {
      "path": "radio/RadioGroup.tsx",
      "content": "import type { ReactNode } from \"react\"\nimport { useContext, useEffect } from \"react\"\nimport { FieldError, Label, RadioGroup as RACRadioGroup, Text } from \"react-aria-components\"\nimport { FormStateContext } from \"../../form-state\"\nimport { getRadioGroupStyles } from \"./radio.styles\"\n\ninterface RadioGroupProps {\n\treadonly label?: string\n\treadonly value?: string | null\n\treadonly defaultValue?: string\n\treadonly isDisabled?: boolean\n\treadonly isRequired?: boolean\n\treadonly isReadOnly?: boolean\n\treadonly isInvalid?: boolean\n\treadonly validationBehavior?: \"aria\" | \"native\"\n\treadonly validate?: (value: string) => string | string[] | true | null | undefined\n\treadonly orientation?: \"horizontal\" | \"vertical\"\n\treadonly name?: string\n\treadonly description?: string\n\treadonly errorMessage?: string\n\treadonly onChange?: (value: string) => void\n\treadonly children?: ReactNode\n}\n\nexport function RadioGroup({\n\tlabel,\n\tvalue,\n\tdefaultValue,\n\tisDisabled = false,\n\tisRequired = false,\n\tisReadOnly = false,\n\tisInvalid = false,\n\tvalidationBehavior,\n\tvalidate,\n\torientation = \"vertical\",\n\tname,\n\tdescription,\n\terrorMessage,\n\tonChange,\n\tchildren,\n}: RadioGroupProps) {\n\tconst styles = getRadioGroupStyles()\n\tconst formCtx = useContext(FormStateContext)\n\n\t// biome-ignore lint/correctness/useExhaustiveDependencies: intentional mount-only seed\n\tuseEffect(() => {\n\t\tconst key = name ?? label\n\t\tif (defaultValue !== undefined && key) formCtx?.setValue(key, defaultValue)\n\t}, [])\n\n\tconst handleChange = (v: string) => {\n\t\tconst key = name ?? label\n\t\tif (key) formCtx?.setValue(key, v)\n\t\tonChange?.(v)\n\t}\n\n\treturn (\n\t\t<RACRadioGroup\n\t\t\tvalue={value}\n\t\t\tdefaultValue={defaultValue}\n\t\t\tisDisabled={isDisabled}\n\t\t\tisRequired={isRequired}\n\t\t\tisReadOnly={isReadOnly}\n\t\t\tisInvalid={isInvalid}\n\t\t\tvalidationBehavior={validationBehavior}\n\t\t\tvalidate={validate}\n\t\t\torientation={orientation}\n\t\t\tname={name}\n\t\t\tonChange={handleChange}\n\t\t\tclassName={styles.group}\n\t\t>\n\t\t\t{label && (\n\t\t\t\t<Label className={styles.label}>\n\t\t\t\t\t{label}\n\t\t\t\t\t{isRequired && (\n\t\t\t\t\t\t<span aria-hidden=\"true\" className={styles.requiredIndicator}>\n\t\t\t\t\t\t\t{\" \"}\n\t\t\t\t\t\t\t*\n\t\t\t\t\t\t</span>\n\t\t\t\t\t)}\n\t\t\t\t</Label>\n\t\t\t)}\n\t\t\t{description && (\n\t\t\t\t<Text slot=\"description\" className={styles.description}>\n\t\t\t\t\t{description}\n\t\t\t\t</Text>\n\t\t\t)}\n\t\t\t<div className={styles.items(orientation)}>{children}</div>\n\t\t\t<FieldError className={styles.errorMessage}>{errorMessage}</FieldError>\n\t\t</RACRadioGroup>\n\t)\n}\n",
      "type": "registry:component"
    },
    {
      "path": "radio/index.ts",
      "content": "export { Radio } from \"./Radio\"\nexport { RadioGroup } from \"./RadioGroup\"\nexport type { RadioGroupNode, RadioNode } from \"./radio.schema\"\nexport { RadioGroupSchema, RadioSchema } from \"./radio.schema\"\n",
      "type": "registry:component"
    },
    {
      "path": "radio/radio.schema.ts",
      "content": "import { z } from \"zod\"\nimport { groupSchemaFields } from \"../group-schema-fields.ts\"\n\nexport const RadioSchema = z.object({\n\ttype: z.literal(\"Radio\"),\n\tprops: z\n\t\t.object({\n\t\t\tlabel: z.string().optional(),\n\t\t\tvalue: z.string(),\n\t\t\tisDisabled: z.boolean().optional(),\n\t\t})\n\t\t.strict()\n\t\t.optional(),\n})\n\nexport type RadioNode = z.infer<typeof RadioSchema>\n\nexport const RadioGroupSchema = z.object({\n\ttype: z.literal(\"RadioGroup\"),\n\tprops: z\n\t\t.object({\n\t\t\tlabel: z.string().optional(),\n\t\t\tvalue: z.string().optional(),\n\t\t\tdefaultValue: z.string().optional(),\n\t\t\t...groupSchemaFields,\n\t\t})\n\t\t.strict()\n\t\t.optional(),\n\tchildren: z.array(RadioSchema).optional(),\n})\n\nexport type RadioGroupNode = z.infer<typeof RadioGroupSchema>\n",
      "type": "registry:component"
    },
    {
      "path": "radio/radio.styles.ts",
      "content": "interface IndicatorState {\n\tisSelected: boolean\n\tisDisabled?: boolean\n\tisInvalid?: boolean\n}\n\nconst indicatorBase = \"w-4 h-4 shrink-0 rounded-full border-2 flex items-center justify-center transition-colors\"\n\nexport const getRadioStyles = () => ({\n\tfield: \"flex flex-col gap-1\",\n\tbutton: \"flex items-center gap-2 text-sm text-(--color-text) cursor-pointer select-none\",\n\tindicator({ isSelected, isDisabled, isInvalid }: IndicatorState) {\n\t\tif (isDisabled) {\n\t\t\treturn `${indicatorBase} bg-(--color-background-muted) border-(--color-border) opacity-50`\n\t\t}\n\t\tif (isSelected) {\n\t\t\treturn `${indicatorBase} bg-(--color-background) border-(--color-primary)`\n\t\t}\n\t\tif (isInvalid) {\n\t\t\treturn `${indicatorBase} bg-(--color-background) border-(--color-danger)`\n\t\t}\n\t\treturn `${indicatorBase} bg-(--color-background) border-(--color-border)`\n\t},\n\tdot: \"w-2 h-2 rounded-full bg-(--color-primary)\",\n})\n\nexport const getRadioGroupStyles = () => ({\n\tgroup: \"flex flex-col gap-2\",\n\tlabel: \"text-sm font-medium text-(--color-text)\",\n\trequiredIndicator: \"text-(--color-danger)\",\n\titems: (orientation: \"horizontal\" | \"vertical\" = \"vertical\") =>\n\t\torientation === \"horizontal\" ? \"flex flex-row flex-wrap gap-4\" : \"flex flex-col gap-2\",\n\tdescription: \"text-xs text-(--color-text-muted)\",\n\terrorMessage: \"text-xs text-(--color-danger)\",\n})\n",
      "type": "registry:component"
    },
    {
      "path": "group-schema-fields.ts",
      "content": "import { z } from \"zod\"\n\nexport const groupSchemaFields = {\n\tisDisabled: z.boolean().optional(),\n\tisRequired: z.boolean().optional(),\n\tisReadOnly: z.boolean().optional(),\n\tisInvalid: z.boolean().optional(),\n\tvalidationBehavior: z.enum([\"aria\", \"native\"]).optional(),\n\torientation: z.enum([\"horizontal\", \"vertical\"]).optional(),\n\tname: z.string().optional(),\n\tdescription: z.string().optional(),\n\terrorMessage: z.string().optional(),\n}\n",
      "type": "registry:component"
    }
  ]
}
