{
  "$schema": "https://raw.githubusercontent.com/roonga/a2-react-aria/main/registry/schema.json",
  "name": "text-field",
  "type": "registry:component",
  "title": "TextField",
  "description": "Single-line text input with label and validation.",
  "dependencies": [
    "react-aria-components",
    "zod"
  ],
  "registryDependencies": [],
  "files": [
    {
      "path": "text-field/TextField.tsx",
      "content": "import { useContext, useEffect, useId, useState, useSyncExternalStore } from \"react\"\nimport { FieldError, Input, Label, TextField as RACTextField, Text } from \"react-aria-components\"\nimport { FormStateContext } from \"../../form-state\"\nimport { getTextFieldStyles } from \"./text-field.styles\"\n\n/** Nothing here ever changes, so the subscription is a noop. */\nconst subscribeToNothing = () => () => {}\nconst hydrationFinished = () => false\nconst stillHydrating = () => true\n\n/**\n * Whether this render is the one attaching React to server-rendered markup.\n *\n * `useSyncExternalStore` answers from its server snapshot while a tree hydrates and from\n * its client snapshot on every render afterwards, which is the same mechanism React Aria's\n * own `useIsSSR` is built on. It is the only signal that separates \"React is adopting\n * markup a browser has already been showing\" from an ordinary client mount, and the\n * difference matters below: only the first case can have a value on screen that the\n * component does not yet know about.\n */\nfunction useIsHydrating(): boolean {\n\treturn useSyncExternalStore(subscribeToNothing, hydrationFinished, stillHydrating)\n}\n\ninterface TextFieldProps {\n\treadonly label?: string\n\treadonly placeholder?: string\n\treadonly type?: \"text\" | \"email\" | \"password\" | \"number\" | \"tel\" | \"url\"\n\treadonly name?: string\n\treadonly value?: string\n\treadonly defaultValue?: string\n\treadonly isDisabled?: boolean\n\treadonly isRequired?: boolean\n\treadonly isReadOnly?: boolean\n\treadonly isInvalid?: boolean\n\treadonly autoFocus?: boolean\n\treadonly autoComplete?: string\n\treadonly inputMode?: \"text\" | \"numeric\" | \"decimal\" | \"email\" | \"tel\" | \"url\" | \"search\"\n\treadonly validationBehavior?: \"aria\" | \"native\"\n\treadonly validate?: (value: string) => string | string[] | true | null | undefined\n\treadonly minLength?: number\n\treadonly maxLength?: number\n\treadonly pattern?: string\n\treadonly description?: string\n\treadonly errorMessage?: string\n\treadonly onChange?: (value: string) => void\n}\n\nexport function TextField({\n\tlabel,\n\tplaceholder,\n\ttype = \"text\",\n\tname,\n\tvalue,\n\tdefaultValue,\n\tisDisabled = false,\n\tisRequired = false,\n\tisReadOnly = false,\n\tisInvalid = false,\n\tautoFocus,\n\tautoComplete,\n\tinputMode,\n\tvalidationBehavior,\n\tvalidate,\n\tminLength,\n\tmaxLength,\n\tpattern,\n\tdescription,\n\terrorMessage,\n\tonChange,\n}: TextFieldProps) {\n\tconst styles = getTextFieldStyles()\n\tconst formCtx = useContext(FormStateContext)\n\tconst fieldId = useId()\n\tconst isHydrating = useIsHydrating()\n\n\t// What the server-rendered input already holds, read once during the hydrating render\n\t// and before React can overwrite it.\n\t//\n\t// React Aria renders a CONTROLLED input whatever it is handed: `useTextField` always\n\t// puts `value` into `inputProps`, seeded from `defaultValue || \"\"`. So on a\n\t// server-rendered page the commit that attaches React writes that initial state onto\n\t// the DOM and silently discards whatever a person typed into the input while the\n\t// bundle was still downloading. On a `required` field the loss is worse than\n\t// cosmetic: the browser's own constraint validation then refuses the submit, with no\n\t// submit event, no request and no message.\n\t//\n\t// Only a value that DIFFERS from what the server rendered is adopted, so a page where\n\t// nobody typed early behaves exactly as before. A controlled field is left alone: its\n\t// value is the consumer's to decide, not the DOM's.\n\tconst [hydratedValue] = useState<string | undefined>(() => {\n\t\tif (value !== undefined || !isHydrating || typeof document === \"undefined\") return undefined\n\t\tconst element = document.getElementById(fieldId)\n\t\tif (!(element instanceof HTMLInputElement)) return undefined\n\t\treturn element.value === (defaultValue ?? \"\") ? undefined : element.value\n\t})\n\tconst initialValue = hydratedValue ?? defaultValue\n\n\t// biome-ignore lint/correctness/useExhaustiveDependencies: intentional mount-only seed\n\tuseEffect(() => {\n\t\tconst key = name ?? label\n\t\tif (initialValue !== undefined && key) formCtx?.setValue(key, initialValue)\n\t}, [])\n\n\tconst handleChange = (v: string) => {\n\t\tconst key = name ?? label\n\t\tif (key) formCtx?.setValue(key, v)\n\t\tonChange?.(v)\n\t}\n\n\treturn (\n\t\t<RACTextField\n\t\t\tid={fieldId}\n\t\t\ttype={type}\n\t\t\tname={name}\n\t\t\tvalue={value}\n\t\t\tdefaultValue={initialValue}\n\t\t\tisDisabled={isDisabled}\n\t\t\tisRequired={isRequired}\n\t\t\tisReadOnly={isReadOnly}\n\t\t\tisInvalid={isInvalid}\n\t\t\tautoFocus={autoFocus}\n\t\t\tautoComplete={autoComplete}\n\t\t\tvalidationBehavior={validationBehavior}\n\t\t\tvalidate={validate}\n\t\t\tminLength={minLength}\n\t\t\tmaxLength={maxLength}\n\t\t\tpattern={pattern}\n\t\t\tonChange={handleChange}\n\t\t\tclassName={styles.container}\n\t\t>\n\t\t\t{label && (\n\t\t\t\t<Label className={styles.label}>\n\t\t\t\t\t{label}\n\t\t\t\t\t{isRequired && (\n\t\t\t\t\t\t<span aria-hidden=\"true\" className={styles.requiredIndicator}>\n\t\t\t\t\t\t\t{\" \"}\n\t\t\t\t\t\t\t*\n\t\t\t\t\t\t</span>\n\t\t\t\t\t)}\n\t\t\t\t</Label>\n\t\t\t)}\n\t\t\t{description && (\n\t\t\t\t<Text slot=\"description\" className={styles.description}>\n\t\t\t\t\t{description}\n\t\t\t\t</Text>\n\t\t\t)}\n\t\t\t<Input placeholder={placeholder} inputMode={inputMode} className={styles.input} />\n\t\t\t<FieldError className={styles.errorMessage}>\n\t\t\t\t{({ validationErrors }) => errorMessage ?? validationErrors.join(\", \")}\n\t\t\t</FieldError>\n\t\t</RACTextField>\n\t)\n}\n",
      "type": "registry:component"
    },
    {
      "path": "text-field/index.ts",
      "content": "export { TextField } from \"./TextField\"\nexport type { TextFieldNode } from \"./text-field.schema\"\nexport { TextFieldSchema } from \"./text-field.schema\"\n",
      "type": "registry:component"
    },
    {
      "path": "text-field/text-field.schema.ts",
      "content": "import { z } from \"zod\"\n\nexport const TextFieldSchema = z.object({\n\ttype: z.literal(\"TextField\"),\n\tprops: z\n\t\t.object({\n\t\t\tlabel: z.string().optional(),\n\t\t\tplaceholder: z.string().optional(),\n\t\t\ttype: z.enum([\"text\", \"email\", \"password\", \"number\", \"tel\", \"url\"]).optional(),\n\t\t\tname: z.string().optional(),\n\t\t\tvalue: z.string().optional(),\n\t\t\tdefaultValue: z.string().optional(),\n\t\t\tisDisabled: z.boolean().optional(),\n\t\t\tisRequired: z.boolean().optional(),\n\t\t\tisReadOnly: z.boolean().optional(),\n\t\t\tisInvalid: z.boolean().optional(),\n\t\t\tautoFocus: z.boolean().optional(),\n\t\t\tautoComplete: z.string().optional(),\n\t\t\tinputMode: z.enum([\"text\", \"numeric\", \"decimal\", \"email\", \"tel\", \"url\", \"search\"]).optional(),\n\t\t\tvalidationBehavior: z.enum([\"aria\", \"native\"]).optional(),\n\t\t\tminLength: z.number().optional(),\n\t\t\tmaxLength: z.number().optional(),\n\t\t\tpattern: z.string().optional(),\n\t\t\tdescription: z.string().optional(),\n\t\t\terrorMessage: z.string().optional(),\n\t\t})\n\t\t.strict()\n\t\t.optional(),\n})\n\nexport type TextFieldNode = z.infer<typeof TextFieldSchema>\n",
      "type": "registry:component"
    },
    {
      "path": "text-field/text-field.styles.ts",
      "content": "export const getTextFieldStyles = () => ({\n\tcontainer: \"flex flex-col gap-2\",\n\tlabel: \"text-sm font-medium text-(--color-text)\",\n\tinput:\n\t\t\"px-3 py-2.5 border border-(--color-border) rounded bg-(--color-background) text-(--color-text) placeholder-(--color-text-muted) focus:outline-none focus:ring-2 focus:ring-(--color-primary) focus:border-transparent disabled:bg-(--color-background-muted) disabled:cursor-not-allowed aria-[invalid]:border-(--color-danger) aria-[invalid]:focus:ring-(--color-danger)\",\n\tdescription: \"text-xs text-(--color-text-muted)\",\n\terrorMessage: \"text-xs text-(--color-danger)\",\n\trequiredIndicator: \"text-(--color-danger)\",\n})\n",
      "type": "registry:component"
    }
  ]
}
