{
  "$schema": "https://raw.githubusercontent.com/roonga/a2-react-aria/main/registry/schema.json",
  "name": "popover",
  "type": "registry:component",
  "title": "Popover",
  "description": "Non-modal floating overlay.",
  "dependencies": [
    "react-aria-components",
    "zod"
  ],
  "registryDependencies": [],
  "files": [
    {
      "path": "popover/Popover.tsx",
      "content": "import type { ReactNode } from \"react\"\nimport { Button, DialogTrigger, Popover as RACPopover } from \"react-aria-components\"\nimport { getPopoverStyles } from \"./popover.styles\"\n\ninterface PopoverProps {\n\treadonly triggerLabel?: string\n\treadonly placement?: \"top\" | \"bottom\" | \"left\" | \"right\"\n\treadonly isOpen?: boolean\n\treadonly defaultOpen?: boolean\n\treadonly offset?: number\n\treadonly crossOffset?: number\n\treadonly shouldFlip?: boolean\n\treadonly isKeyboardDismissDisabled?: boolean\n\treadonly maxHeight?: number\n\treadonly onOpenChange?: (isOpen: boolean) => void\n\treadonly children?: ReactNode\n}\n\nexport function Popover({\n\ttriggerLabel = \"Open\",\n\tplacement = \"bottom\",\n\tisOpen,\n\tdefaultOpen,\n\toffset = 8,\n\tcrossOffset,\n\tshouldFlip,\n\tisKeyboardDismissDisabled,\n\tmaxHeight,\n\tonOpenChange,\n\tchildren,\n}: PopoverProps) {\n\tconst styles = getPopoverStyles()\n\n\treturn (\n\t\t<DialogTrigger isOpen={isOpen} defaultOpen={defaultOpen} onOpenChange={onOpenChange}>\n\t\t\t<Button className={styles.trigger}>{triggerLabel}</Button>\n\t\t\t<RACPopover\n\t\t\t\tplacement={placement}\n\t\t\t\toffset={offset}\n\t\t\t\tcrossOffset={crossOffset}\n\t\t\t\tshouldFlip={shouldFlip}\n\t\t\t\tisKeyboardDismissDisabled={isKeyboardDismissDisabled}\n\t\t\t\tmaxHeight={maxHeight}\n\t\t\t\tclassName={styles.popover}\n\t\t\t>\n\t\t\t\t{children}\n\t\t\t</RACPopover>\n\t\t</DialogTrigger>\n\t)\n}\n",
      "type": "registry:component"
    },
    {
      "path": "popover/index.ts",
      "content": "export { Popover } from \"./Popover\"\nexport type { PopoverNode } from \"./popover.schema\"\nexport { PopoverSchema } from \"./popover.schema\"\n",
      "type": "registry:component"
    },
    {
      "path": "popover/popover.schema.ts",
      "content": "import { z } from \"zod\"\nimport { A2NodeSchema } from \"../../schema/index.ts\"\n\nexport const PopoverSchema = z.object({\n\ttype: z.literal(\"Popover\"),\n\tprops: z\n\t\t.object({\n\t\t\ttriggerLabel: z.string().optional(),\n\t\t\tplacement: z.enum([\"top\", \"bottom\", \"left\", \"right\"]).optional(),\n\t\t\tisOpen: z.boolean().optional(),\n\t\t\tdefaultOpen: z.boolean().optional(),\n\t\t\toffset: z.number().optional(),\n\t\t\tcrossOffset: z.number().optional(),\n\t\t\tshouldFlip: z.boolean().optional(),\n\t\t\tisKeyboardDismissDisabled: z.boolean().optional(),\n\t\t\tmaxHeight: z.number().optional(),\n\t\t})\n\t\t.strict()\n\t\t.optional(),\n\tchildren: z.array(A2NodeSchema).optional(),\n})\n\nexport type PopoverNode = z.infer<typeof PopoverSchema>\n",
      "type": "registry:component"
    },
    {
      "path": "popover/popover.styles.ts",
      "content": "export const getPopoverStyles = () => ({\n\tpopover: [\n\t\t\"rounded-xl p-3 min-w-[200px] outline-none\",\n\t\t\"bg-(--color-background) border border-(--color-border)\",\n\t\t\"shadow-xl\",\n\t\t\"data-[entering]:animate-in data-[entering]:fade-in\",\n\t\t\"data-[exiting]:animate-out data-[exiting]:fade-out duration-150\",\n\t].join(\" \"),\n\ttrigger: [\n\t\t\"rounded px-3 py-1.5 text-sm font-medium\",\n\t\t\"bg-(--color-backgroundMuted) text-(--color-text)\",\n\t\t\"border border-(--color-border)\",\n\t\t\"hover:bg-(--color-border) transition-colors\",\n\t\t\"focus-visible:outline-2 focus-visible:outline-(--color-primary)\",\n\t].join(\" \"),\n})\n",
      "type": "registry:component"
    }
  ]
}
