{
  "$schema": "https://raw.githubusercontent.com/roonga/a2-react-aria/main/registry/schema.json",
  "name": "text-area",
  "type": "registry:component",
  "title": "TextArea",
  "description": "Multiline text input with label, validation, and error messages.",
  "dependencies": [
    "react-aria-components",
    "zod"
  ],
  "registryDependencies": [],
  "files": [
    {
      "path": "text-area/TextArea.tsx",
      "content": "import { useContext, useEffect } from \"react\"\nimport { FieldError, Label, TextArea as RACTextArea, TextField as RACTextField, Text } from \"react-aria-components\"\nimport { FormStateContext } from \"../../form-state\"\nimport { getTextAreaStyles } from \"./text-area.styles\"\n\ninterface TextAreaProps {\n\treadonly label?: string\n\treadonly placeholder?: string\n\treadonly name?: string\n\treadonly value?: string\n\treadonly defaultValue?: string\n\treadonly rows?: number\n\treadonly isDisabled?: boolean\n\treadonly isRequired?: boolean\n\treadonly isReadOnly?: boolean\n\treadonly isInvalid?: boolean\n\treadonly autoFocus?: boolean\n\treadonly autoComplete?: string\n\treadonly validationBehavior?: \"aria\" | \"native\"\n\treadonly validate?: (value: string) => string | string[] | true | null | undefined\n\treadonly minLength?: number\n\treadonly maxLength?: number\n\treadonly description?: string\n\treadonly errorMessage?: string\n\treadonly onChange?: (value: string) => void\n}\n\nexport function TextArea({\n\tlabel,\n\tplaceholder,\n\tname,\n\tvalue,\n\tdefaultValue,\n\trows,\n\tisDisabled = false,\n\tisRequired = false,\n\tisReadOnly = false,\n\tisInvalid = false,\n\tautoFocus,\n\tautoComplete,\n\tvalidationBehavior,\n\tvalidate,\n\tminLength,\n\tmaxLength,\n\tdescription,\n\terrorMessage,\n\tonChange,\n}: TextAreaProps) {\n\tconst styles = getTextAreaStyles()\n\tconst formCtx = useContext(FormStateContext)\n\n\t// biome-ignore lint/correctness/useExhaustiveDependencies: intentional mount-only seed\n\tuseEffect(() => {\n\t\tconst key = name ?? label\n\t\tif (defaultValue !== undefined && key) formCtx?.setValue(key, defaultValue)\n\t}, [])\n\n\tconst handleChange = (v: string) => {\n\t\tconst key = name ?? label\n\t\tif (key) formCtx?.setValue(key, v)\n\t\tonChange?.(v)\n\t}\n\n\treturn (\n\t\t<RACTextField\n\t\t\tname={name}\n\t\t\tvalue={value}\n\t\t\tdefaultValue={defaultValue}\n\t\t\tisDisabled={isDisabled}\n\t\t\tisRequired={isRequired}\n\t\t\tisReadOnly={isReadOnly}\n\t\t\tisInvalid={isInvalid}\n\t\t\tautoFocus={autoFocus}\n\t\t\tautoComplete={autoComplete}\n\t\t\tvalidationBehavior={validationBehavior}\n\t\t\tvalidate={validate}\n\t\t\tminLength={minLength}\n\t\t\tmaxLength={maxLength}\n\t\t\tonChange={handleChange}\n\t\t\tclassName={styles.container}\n\t\t>\n\t\t\t{label && (\n\t\t\t\t<Label className={styles.label}>\n\t\t\t\t\t{label}\n\t\t\t\t\t{isRequired && (\n\t\t\t\t\t\t<span aria-hidden=\"true\" className={styles.requiredIndicator}>\n\t\t\t\t\t\t\t{\" \"}\n\t\t\t\t\t\t\t*\n\t\t\t\t\t\t</span>\n\t\t\t\t\t)}\n\t\t\t\t</Label>\n\t\t\t)}\n\t\t\t{description && (\n\t\t\t\t<Text slot=\"description\" className={styles.description}>\n\t\t\t\t\t{description}\n\t\t\t\t</Text>\n\t\t\t)}\n\t\t\t<RACTextArea placeholder={placeholder} rows={rows} className={styles.textarea} />\n\t\t\t<FieldError className={styles.errorMessage}>\n\t\t\t\t{({ validationErrors }) => errorMessage ?? validationErrors.join(\", \")}\n\t\t\t</FieldError>\n\t\t</RACTextField>\n\t)\n}\n",
      "type": "registry:component"
    },
    {
      "path": "text-area/index.ts",
      "content": "export { TextArea } from \"./TextArea\"\nexport type { TextAreaNode } from \"./text-area.schema\"\nexport { TextAreaSchema } from \"./text-area.schema\"\n",
      "type": "registry:component"
    },
    {
      "path": "text-area/text-area.schema.ts",
      "content": "import { z } from \"zod\"\n\nexport const TextAreaSchema = z.object({\n\ttype: z.literal(\"TextArea\"),\n\tprops: z\n\t\t.object({\n\t\t\tlabel: z.string().optional(),\n\t\t\tplaceholder: z.string().optional(),\n\t\t\tname: z.string().optional(),\n\t\t\tvalue: z.string().optional(),\n\t\t\tdefaultValue: z.string().optional(),\n\t\t\trows: z.number().int().positive().optional(),\n\t\t\tisDisabled: z.boolean().optional(),\n\t\t\tisRequired: z.boolean().optional(),\n\t\t\tisReadOnly: z.boolean().optional(),\n\t\t\tisInvalid: z.boolean().optional(),\n\t\t\tautoFocus: z.boolean().optional(),\n\t\t\tautoComplete: z.string().optional(),\n\t\t\tvalidationBehavior: z.enum([\"aria\", \"native\"]).optional(),\n\t\t\tminLength: z.number().optional(),\n\t\t\tmaxLength: z.number().optional(),\n\t\t\tdescription: z.string().optional(),\n\t\t\terrorMessage: z.string().optional(),\n\t\t})\n\t\t.strict()\n\t\t.optional(),\n})\n\nexport type TextAreaNode = z.infer<typeof TextAreaSchema>\n",
      "type": "registry:component"
    },
    {
      "path": "text-area/text-area.styles.ts",
      "content": "export const getTextAreaStyles = () => ({\n\tcontainer: \"flex flex-col gap-2\",\n\tlabel: \"text-sm font-medium text-(--color-text)\",\n\ttextarea:\n\t\t\"px-3 py-2.5 min-h-24 resize-y border border-(--color-border) rounded bg-(--color-background) text-(--color-text) placeholder-(--color-text-muted) focus:outline-none focus:ring-2 focus:ring-(--color-primary) focus:border-transparent disabled:bg-(--color-background-muted) disabled:cursor-not-allowed disabled:resize-none aria-[invalid]:border-(--color-danger) aria-[invalid]:focus:ring-(--color-danger)\",\n\tdescription: \"text-xs text-(--color-text-muted)\",\n\terrorMessage: \"text-xs text-(--color-danger)\",\n\trequiredIndicator: \"text-(--color-danger)\",\n})\n",
      "type": "registry:component"
    }
  ]
}
