{
  "$schema": "https://raw.githubusercontent.com/roonga/a2-react-aria/main/registry/schema.json",
  "name": "select",
  "type": "registry:component",
  "title": "Select",
  "description": "Select / ComboBox dropdown input.",
  "dependencies": [
    "react-aria-components",
    "zod"
  ],
  "registryDependencies": [],
  "files": [
    {
      "path": "select/Select.tsx",
      "content": "import { useContext, useEffect } from \"react\"\nimport {\n\tButton,\n\tFieldError,\n\tLabel,\n\tListBox,\n\tListBoxItem,\n\tPopover,\n\tSelect as RACSelect,\n\tSelectValue,\n\tText,\n} from \"react-aria-components\"\nimport { FormStateContext } from \"../../form-state\"\nimport type { SelectItem } from \"./select.schema\"\nimport { getSelectStyles } from \"./select.styles\"\n\ninterface SelectProps {\n\treadonly label?: string\n\treadonly placeholder?: string\n\treadonly items?: SelectItem[]\n\treadonly value?: string | null\n\treadonly defaultValue?: string\n\treadonly isDisabled?: boolean\n\treadonly isRequired?: boolean\n\treadonly isInvalid?: boolean\n\treadonly isOpen?: boolean\n\treadonly defaultOpen?: boolean\n\treadonly disabledKeys?: string[]\n\treadonly validationBehavior?: \"aria\" | \"native\"\n\treadonly validate?: (value: string) => string | string[] | true | null | undefined\n\treadonly name?: string\n\treadonly description?: string\n\treadonly errorMessage?: string\n\treadonly onChange?: (value: string) => void\n\treadonly onOpenChange?: (isOpen: boolean) => void\n}\n\nexport function Select({\n\tlabel,\n\tplaceholder = \"Select an option\",\n\titems = [],\n\tvalue,\n\tdefaultValue,\n\tisDisabled = false,\n\tisRequired = false,\n\tisInvalid = false,\n\tisOpen,\n\tdefaultOpen,\n\tdisabledKeys,\n\tvalidationBehavior,\n\tvalidate,\n\tname,\n\tdescription,\n\terrorMessage,\n\tonChange,\n\tonOpenChange,\n}: SelectProps) {\n\tconst styles = getSelectStyles()\n\tconst formCtx = useContext(FormStateContext)\n\n\t// biome-ignore lint/correctness/useExhaustiveDependencies: intentional mount-only seed\n\tuseEffect(() => {\n\t\tconst key = name ?? label\n\t\tif (defaultValue !== undefined && key) formCtx?.setValue(key, defaultValue)\n\t}, [])\n\n\treturn (\n\t\t<RACSelect\n\t\t\tselectedKey={value}\n\t\t\tdefaultSelectedKey={defaultValue}\n\t\t\tisDisabled={isDisabled}\n\t\t\tisRequired={isRequired}\n\t\t\tisInvalid={isInvalid}\n\t\t\tisOpen={isOpen}\n\t\t\tdefaultOpen={defaultOpen}\n\t\t\tvalidationBehavior={validationBehavior}\n\t\t\tvalidate={validate ? (key) => validate(key as string) : undefined}\n\t\t\tname={name}\n\t\t\tplaceholder={placeholder}\n\t\t\tonSelectionChange={(key) => {\n\t\t\t\tconst v = key as string\n\t\t\t\tconst fKey = name ?? label\n\t\t\t\tif (fKey) formCtx?.setValue(fKey, v)\n\t\t\t\tonChange?.(v)\n\t\t\t}}\n\t\t\tonOpenChange={onOpenChange}\n\t\t\tclassName={styles.field}\n\t\t>\n\t\t\t{label && (\n\t\t\t\t<Label className={styles.label}>\n\t\t\t\t\t{label}\n\t\t\t\t\t{isRequired && (\n\t\t\t\t\t\t<span aria-hidden=\"true\" className={styles.requiredIndicator}>\n\t\t\t\t\t\t\t{\" \"}\n\t\t\t\t\t\t\t*\n\t\t\t\t\t\t</span>\n\t\t\t\t\t)}\n\t\t\t\t</Label>\n\t\t\t)}\n\t\t\t{description && (\n\t\t\t\t<Text slot=\"description\" className={styles.description}>\n\t\t\t\t\t{description}\n\t\t\t\t</Text>\n\t\t\t)}\n\t\t\t<Button className={({ isDisabled: dis }) => styles.trigger({ isDisabled: dis, isInvalid })}>\n\t\t\t\t<SelectValue>\n\t\t\t\t\t{({ selectedText, isPlaceholder }) => (\n\t\t\t\t\t\t<span className={isPlaceholder ? styles.placeholder : styles.value}>\n\t\t\t\t\t\t\t{isPlaceholder ? placeholder : selectedText}\n\t\t\t\t\t\t</span>\n\t\t\t\t\t)}\n\t\t\t\t</SelectValue>\n\t\t\t\t<svg\n\t\t\t\t\taria-hidden=\"true\"\n\t\t\t\t\tviewBox=\"0 0 16 16\"\n\t\t\t\t\tfill=\"none\"\n\t\t\t\t\tstroke=\"currentColor\"\n\t\t\t\t\tstrokeWidth={1.5}\n\t\t\t\t\tclassName={styles.chevron}\n\t\t\t\t>\n\t\t\t\t\t<path d=\"M4 6l4 4 4-4\" strokeLinecap=\"round\" strokeLinejoin=\"round\" />\n\t\t\t\t</svg>\n\t\t\t</Button>\n\t\t\t<FieldError className={styles.errorMessage}>{errorMessage}</FieldError>\n\t\t\t<Popover className={styles.popover}>\n\t\t\t\t<ListBox disabledKeys={disabledKeys} className={styles.listbox}>\n\t\t\t\t\t{items.map((item) => (\n\t\t\t\t\t\t<ListBoxItem key={item.value} id={item.value} isDisabled={item.isDisabled} className={styles.item}>\n\t\t\t\t\t\t\t{item.label}\n\t\t\t\t\t\t</ListBoxItem>\n\t\t\t\t\t))}\n\t\t\t\t</ListBox>\n\t\t\t</Popover>\n\t\t</RACSelect>\n\t)\n}\n",
      "type": "registry:component"
    },
    {
      "path": "select/index.ts",
      "content": "export { Select } from \"./Select\"\nexport type { SelectItem, SelectNode } from \"./select.schema\"\nexport { SelectSchema } from \"./select.schema\"\n",
      "type": "registry:component"
    },
    {
      "path": "select/select.schema.ts",
      "content": "import { z } from \"zod\"\n\nconst SelectItemSchema = z\n\t.object({\n\t\tlabel: z.string(),\n\t\tvalue: z.string(),\n\t\tisDisabled: z.boolean().optional(),\n\t})\n\t.strict()\n\nexport const SelectSchema = z.object({\n\ttype: z.literal(\"Select\"),\n\tprops: z\n\t\t.object({\n\t\t\tlabel: z.string().optional(),\n\t\t\tplaceholder: z.string().optional(),\n\t\t\titems: z.array(SelectItemSchema).optional(),\n\t\t\tvalue: z.string().optional(),\n\t\t\tdefaultValue: z.string().optional(),\n\t\t\tisDisabled: z.boolean().optional(),\n\t\t\tisRequired: z.boolean().optional(),\n\t\t\tisOpen: z.boolean().optional(),\n\t\t\tdefaultOpen: z.boolean().optional(),\n\t\t\tdisabledKeys: z.array(z.string()).optional(),\n\t\t\tisInvalid: z.boolean().optional(),\n\t\t\tvalidationBehavior: z.enum([\"aria\", \"native\"]).optional(),\n\t\t\tname: z.string().optional(),\n\t\t\tdescription: z.string().optional(),\n\t\t\terrorMessage: z.string().optional(),\n\t\t})\n\t\t.strict()\n\t\t.optional(),\n})\n\nexport type SelectNode = z.infer<typeof SelectSchema>\nexport type SelectItem = z.infer<typeof SelectItemSchema>\n",
      "type": "registry:component"
    },
    {
      "path": "select/select.styles.ts",
      "content": "interface TriggerState {\n\tisDisabled?: boolean\n\tisInvalid?: boolean\n}\n\nconst triggerBase =\n\t\"flex w-full min-w-40 min-h-11 cursor-pointer items-center justify-between gap-2 rounded border px-3 py-2 text-sm transition-colors\"\n\nexport const getSelectStyles = () => ({\n\tfield: \"flex flex-col gap-1\",\n\tlabel: \"text-sm font-medium text-(--color-text)\",\n\trequiredIndicator: \"text-(--color-danger)\",\n\ttrigger({ isDisabled, isInvalid }: TriggerState) {\n\t\tif (isDisabled) {\n\t\t\treturn `${triggerBase} cursor-not-allowed border-(--color-border) bg-(--color-background-muted) opacity-50 text-(--color-text-muted)`\n\t\t}\n\t\tif (isInvalid) {\n\t\t\treturn `${triggerBase} border-(--color-danger) bg-(--color-background) text-(--color-text)`\n\t\t}\n\t\treturn `${triggerBase} border-(--color-border) bg-(--color-background) text-(--color-text) hover:border-(--color-primary)`\n\t},\n\tvalue: \"flex-1 truncate text-left\",\n\tplaceholder: \"text-(--color-text-muted)\",\n\tchevron: \"h-4 w-4 shrink-0 text-(--color-text-muted)\",\n\tpopover: \"z-50 min-w-(--trigger-width) rounded border border-(--color-border) bg-(--color-background) p-1 shadow-md\",\n\tlistbox: \"max-h-64 overflow-auto outline-none\",\n\titem: \"flex cursor-pointer items-center rounded px-3 py-1.5 text-sm text-(--color-text) outline-none transition-colors data-[disabled]:cursor-not-allowed data-[disabled]:opacity-50 data-[focused]:bg-(--color-background-muted) data-[selected]:font-medium data-[selected]:text-(--color-primary)\",\n\tdescription: \"text-xs text-(--color-text-muted)\",\n\terrorMessage: \"text-xs text-(--color-danger)\",\n})\n",
      "type": "registry:component"
    }
  ]
}
